{
  "schema_version": "forest-geospatial-benchmark/1.0",
  "benchmark_id": "ECO-FOREST-GEO-SYN-2026-001",
  "classification": "synthetic_geospatial_plumbing_benchmark",
  "purpose": "Verify fail-closed geospatial metadata, masking, spatial holdout, tiling, polygon, area, and metric plumbing with a small team-authored fixture.",
  "files": {
    "scene_pixels": "synthetic_scene_pixels.csv",
    "reference_mask": "synthetic_reference_mask.csv"
  },
  "grid": {
    "rows": 4,
    "cols": 6,
    "crs": {
      "authority": "EPSG",
      "code": 32652,
      "name": "WGS 84 / UTM zone 52N",
      "kind": "projected",
      "axis_unit": "metre"
    },
    "geotransform": [
      "500000",
      "10",
      "0",
      "4100000",
      "0",
      "-10"
    ],
    "nodata_value": "-9999",
    "pixel_origin": "upper_left_corner"
  },
  "observations": {
    "before": {
      "scene_id": "SYNTH-MSI-20240215-BEFORE",
      "acquired_at": "2024-02-15T02:10:00Z",
      "season_label": "dry",
      "sensor_family": "SYNTHETIC-MULTISPECTRAL",
      "product_level": "synthetic_surface_reflectance",
      "source_kind": "team_authored_synthetic"
    },
    "after": {
      "scene_id": "SYNTH-MSI-20250217-AFTER",
      "acquired_at": "2025-02-17T02:12:00Z",
      "season_label": "dry",
      "sensor_family": "SYNTHETIC-MULTISPECTRAL",
      "product_level": "synthetic_surface_reflectance",
      "source_kind": "team_authored_synthetic"
    },
    "seasonality_policy": {
      "require_same_season_label": true,
      "maximum_day_of_year_delta": 7,
      "minimum_elapsed_days": 300,
      "maximum_elapsed_days": 400,
      "timezone": "UTC"
    }
  },
  "masking": {
    "qa_clear_class": "clear",
    "qa_excluded_classes": [
      "cloud",
      "shadow"
    ],
    "nodata_scope": "any_required_band",
    "evaluation_scope": "valid_holdout_pixels_only"
  },
  "prediction_rule": {
    "kind": "fixed_ndvi_threshold",
    "forest_ndvi_min": "0.45",
    "ndvi_decrease_min": "0.25",
    "threshold_provenance": "Thresholds were fixed for a synthetic code-path fixture; they were not fitted to a public or operational scene."
  },
  "tiling": {
    "tile_height": 2,
    "tile_width": 3,
    "order": "row_major",
    "edge_policy": "clip"
  },
  "spatial_split": {
    "strategy": "deterministic_tile_holdout",
    "holdout_tile_ids": [
      "tile-r0000-c0003",
      "tile-r0002-c0003"
    ],
    "reported_metrics_scope": "valid_holdout_pixels_only",
    "selection_provenance": "Right-hand tiles were declared as holdout in the manifest before execution; the split verifies leakage-safe plumbing but is not evidence of learned-model generalization."
  },
  "reference": {
    "kind": "team_authored_synthetic_binary_mask",
    "creator": "EcoGuard public benchmark maintainers",
    "created_at": "2026-08-12T00:00:00Z",
    "method": "Manually fixed binary labels with intentional false-positive and false-negative cases; labels are stored separately from scene bands.",
    "license": "CC0-1.0",
    "independent_ground_truth": false
  },
  "claim_boundary": {
    "demonstrates": [
      "strict offline CRS and affine geotransform contract validation",
      "native projected pixel polygons and affine-determinant area accounting",
      "nodata, cloud, and shadow exclusion before NDVI evaluation",
      "acquisition timestamp and declared seasonality policy validation",
      "deterministic clipped tiling and tile-level spatial holdout plumbing",
      "reference provenance and valid-holdout-only binary metric accounting"
    ],
    "does_not_demonstrate": [
      "real Sentinel or Landsat ingestion, calibration, atmospheric correction, cloud-mask quality, or co-registration",
      "real-world forest-loss accuracy, learned-model generalization, or independent ground truth",
      "geodetic reprojection or RFC 7946 WGS84 interchange",
      "CNN, XAI, production-scale raster performance, field verification, or EUDR compliance"
    ]
  }
}
